[
  {
    "_id": "gumasta-step-1",
    "procedureId": "shop-establishment-gumasta",
    "stepNumber": 1,
    "title": "Prepare premises proof and identity documents",
    "description": "Gather proof that you occupy the business premises (rent agreement or ownership document) plus ID proof of the owner/partners before starting the online application.",
    "department": "Maharashtra Labour Department",
    "documents": [
      "Rent agreement or property ownership proof",
      "NOC from property owner (if rented)",
      "Aadhaar card of owner/partners",
      "PAN card of owner/partners",
      "Passport-size photograph"
    ],
    "fee": null,
    "processingTime": null,
    "applicationUrl": null,
    "sourceUrl": "https://mahakamgar.gov.in/",
    "dependsOn": [],
    "dependencyReason": null,
    "applicability": null,
    "status": "unverified",
    "lastVerified": "2026-09-26"
  },
  {
    "_id": "gumasta-step-2",
    "procedureId": "shop-establishment-gumasta",
    "stepNumber": 2,
    "title": "Register/login on Aaple Sarkar and select Shops & Establishments service",
    "description": "Create an account on the Aaple Sarkar portal (or log in if you already have one) and select 'Registration of Shop and Establishment' under the Labour Department.",
    "department": "Maharashtra Labour Department",
    "documents": [],
    "fee": null,
    "processingTime": null,
    "applicationUrl": "https://aaplesarkar.mahaonline.gov.in/en",
    "sourceUrl": "https://aaplesarkar.mahaonline.gov.in/en",
    "dependsOn": ["gumasta-step-1"],
    "dependencyReason": "Portal account and service selection come before document upload, but premises/ID documents should be ready first so the form can be filled in one sitting",
    "applicability": null,
    "status": "unverified",
    "lastVerified": "2026-09-26"
  },
  {
    "_id": "gumasta-step-3",
    "procedureId": "shop-establishment-gumasta",
    "stepNumber": 3,
    "title": "Fill application form and upload documents",
    "description": "Enter business name, address, nature of business, employer details, and number of employees. Upload scanned copies of all supporting documents.",
    "department": "Maharashtra Labour Department",
    "documents": [
      "Scanned copies of documents from Step 1",
      "Business name and nature-of-business details",
      "Employee count"
    ],
    "fee": null,
    "processingTime": null,
    "applicationUrl": "https://aaplesarkar.mahaonline.gov.in/en",
    "sourceUrl": "https://aaplesarkar.mahaonline.gov.in/en",
    "dependsOn": ["gumasta-step-2"],
    "dependencyReason": "Requires an active portal session and the correct service to be selected first",
    "applicability": null,
    "status": "unverified",
    "lastVerified": "2026-09-26"
  },
  {
    "_id": "gumasta-step-4",
    "procedureId": "shop-establishment-gumasta",
    "stepNumber": 4,
    "title": "Pay government fee",
    "description": "Pay the applicable government fee online. NOTE: exact fee is not confirmed from an official source yet — third-party sources quote figures ranging from roughly ₹100 up to several thousand rupees depending on employee count and registration type (intimation vs. license), and MUST be verified on the live portal.",
    "department": "Maharashtra Labour Department",
    "documents": [],
    "fee": "unverified — confirm on aaplesarkar.mahaonline.gov.in at application time",
    "processingTime": null,
    "applicationUrl": "https://aaplesarkar.mahaonline.gov.in/en",
    "sourceUrl": "https://aaplesarkar.mahaonline.gov.in/en",
    "dependsOn": ["gumasta-step-3"],
    "dependencyReason": "Payment is only enabled after the form is complete and submitted",
    "applicability": null,
    "status": "unverified",
    "lastVerified": "2026-09-26"
  },
  {
    "_id": "gumasta-step-5",
    "procedureId": "shop-establishment-gumasta",
    "stepNumber": 5,
    "title": "Verification and certificate issuance",
    "description": "The application and documents are reviewed by the department. Once approved, the Gumasta registration certificate is issued and sent to the registered email.",
    "department": "Maharashtra Labour Department",
    "documents": [],
    "fee": null,
    "processingTime": "unverified — third-party sources suggest 3-5 working days, not confirmed against an official source",
    "applicationUrl": null,
    "sourceUrl": "https://aaplesarkar.mahaonline.gov.in/en",
    "dependsOn": ["gumasta-step-4"],
    "dependencyReason": "Department review only begins after payment is confirmed",
    "applicability": null,
    "status": "unverified",
    "lastVerified": "2026-09-26"
  }
]
